{
  "classification": {
    "level": "U",
    "metadataLevel": "U"
  },
  "confidence": "explicit",
  "createdAt": "2021-09-30T00:00:00Z",
  "createdBy": {
    "actorId": "shreyash",
    "actorType": "human"
  },
  "evidenceType": "MSStudy",
  "id": "ev-aries-1",
  "inclusionReason": "named on the OMFV Phase 2 schedule as one of the Phase 2 MS&A activities (PDF p. 17 (slide footer 19)); ARIES / performance M&S - Highlights sensitivities between functional requirements in real time to inform the program. Analytics will be performed on mobility, vehicle dynamics, automotive performance, and under-hood cooling M&S.",
  "ingestionProvenance": {
    "extractedAt": "2026-09-06",
    "extractor": "human",
    "locator": "PDF p. 17 (slide footer 19) (timeline); PDF p. 18 (slide footer 20) (description)",
    "sourceArtifact": "sources/army-2020-12-09-omfv-industry-day-briefing.pdf"
  },
  "model": "mdl-aries",
  "pointer": {
    "custodian": "Department of the Army (the study itself is not public); the cited document is the public record that names it",
    "uri": "sources/army-2020-12-09-omfv-industry-day-briefing.pdf#page=17"
  },
  "reliabilitySteps": {
    "$gap": "gap-reliability-steps"
  },
  "rev": 1,
  "reviewStatus": "reviewed",
  "reviewers": [
    {
      "date": "2021",
      "name": "Department of the Army",
      "role": "performing organisation (no review record is public)"
    }
  ],
  "scenarios": {
    "$gap": "gap-model-docs"
  },
  "scopeOfValidity": {
    "builtToAnswer": "the desired characteristics for the OMFV — GAO printed p. 12: \"these analyses were not designed to draw conclusions on force structure alternatives. Instead, the analyses were intended to assess the desired characteristics\"",
    "intendedUse": "Phase 2 modelling, simulation and analysis",
    "questionClass": "desired-characteristics"
  },
  "title": "ARIES 1 — ARIES / performance modelling and simulation, OMFV Phase 2",
  "type": "Evidence",
  "vvaRecord": "vva-aries"
}
